language,keywords,note,year,url,publisher,author,title,ENTRYTYPE,ID,contributor,howpublished
{en},{Speech and Hearing},"{Source: The Hearing Journal ; volume 73, issue 11, page 8,9 ; ISSN 0745-7472}",2020,http://dx.doi.org/10.1097/01.hj.0000722496.35603.8a,{Ovid Technologies (Wolters Kluwer Health)},"Crowson, Matthew G.",{Artificial Intelligence to Support Hearing Loss Diagnostics},article,1ca093c245a226bbb3ba4db5a51894248dce81f3c64da32bbd0d4d7e31897a9f,,
{en},{Speech and Hearing},"{Source: The Hearing Journal ; volume 74, issue 5, page 20,21 ; ISSN 0745-7472}",2021,http://dx.doi.org/10.1097/01.hj.0000752308.11373.cb,{Ovid Technologies (Wolters Kluwer Health)},"Crowson, Matthew G.",{Predicting Depression from Hearing Loss Using Artificial Intelligence},article,7830a35815abc859a842a02284f1e47f3cdb2748554de6adfcb9d6478c9bde1a,,
{en},{Multidisciplinary},"{Source: Scientific Reports ; volume 12, issue 1 ; ISSN 2045-2322 ; Description: Abstract Despite the significance of predicting the prognosis of idiopathic sudden sensorineural hearing loss (ISSNHL), no predictive models have been established. This study used artificial intelligence to develop prognosis models to predict recovery from ISSNHL. We retrospectively reviewed the medical data of 453 patients with ISSNHL (men, 220; women, 233; mean age, 50.3 years) who underwent treatment at a tertiary hospital between January 2021 and December 2019 and were followed up after 1 month. According to Siegel{\textquoteright}s criteria, 203 patients recovered in 1 month. Demographic characteristics, clinical and laboratory data, and pure-tone audiometry were analyzed. Logistic regression (baseline), a support vector machine, extreme gradient boosting, a light gradient boosting machine, and multilayer perceptron were used. The outcomes were the area under the receiver operating characteristic curve (AUROC) primarily, area under the precision-recall curve, Brier score, balanced accuracy, and F1 score. The light gradient boosting machine model had the best AUROC and balanced accuracy. Together with multilayer perceptron, it was also significantly superior to logistic regression in terms of AUROC. Using the SHapley Additive exPlanation method, we found that the initial audiogram shape is the most important prognostic factor. Machine/deep learning methods were successfully established to predict the prognosis of ISSNHL.}",2022,http://dx.doi.org/10.1038/s41598-022-07881-2,{Springer Science and Business Media LLC},"Lee, Min Kyu AND Jeon, Eun-Tae AND Baek, Namyoung AND Kim, Jeong Hwan AND Rah, Yoon Chan AND Choi, June",{Prediction of hearing recovery in unilateral sudden sensorineural hearing loss using artificial intelligence},article,9158d0bbce26d12ea481340f7390bb51b416245de56f219c4d04ed133ca6b2ea,{Korea University Grants},
{EN},{Medicine},"{Source: Scientific Reports, Vol 12, Iss 1, Pp 1-10 (2022) ; Description: Abstract Despite the significance of predicting the prognosis of idiopathic sudden sensorineural hearing loss (ISSNHL), no predictive models have been established. This study used artificial intelligence to develop prognosis models to predict recovery from ISSNHL. We retrospectively reviewed the medical data of 453 patients with ISSNHL (men, 220; women, 233; mean age, 50.3 years) who underwent treatment at a tertiary hospital between January 2021 and December 2019 and were followed up after 1 month. According to Siegel{\textquoteright}s criteria, 203 patients recovered in 1 month. Demographic characteristics, clinical and laboratory data, and pure-tone audiometry were analyzed. Logistic regression (baseline), a support vector machine, extreme gradient boosting, a light gradient boosting machine, and multilayer perceptron were used. The outcomes were the area under the receiver operating characteristic curve (AUROC) primarily, area under the precision-recall curve, Brier score, balanced accuracy, and F1 score. The light gradient boosting machine model had the best AUROC and balanced accuracy. Together with multilayer perceptron, it was also significantly superior to logistic regression in terms of AUROC. Using the SHapley Additive exPlanation method, we found that the initial audiogram shape is the most important prognostic factor. Machine/deep learning methods were successfully established to predict the prognosis of ISSNHL.}",2022,https://doi.org/10.1038/s41598-022-07881-2,{Nature Portfolio},Min Kyu Lee AND Eun-Tae Jeon AND Namyoung Baek AND Jeong Hwan Kim AND Yoon Chan Rah AND June Choi,{Prediction of hearing recovery in unilateral sudden sensorineural hearing loss using artificial intelligence},article,6cfbbc993d05376d1be834ec593581d78e83499da31cdf53234964d7d2ee2282,,
{EN},{hearing-loss symptoms},"{Source: Sustainability; Volume 13; Issue 10; Pages: 5406 ; Description: Multidisciplinary Digital Publishing Institute ; Physicians depend on their insight and experience and on a fundamentally indicative or symptomatic approach to decide on the possible ailment of a patient. However, numerous phases of problem identification and longer strategies can prompt a longer time for consulting and can subsequently cause other patients that require attention to wait for longer. This can bring about pressure and tension concerning those patients. In this study, we focus on developing a decision-support system for diagnosing the symptoms as a result of hearing loss. The model is implemented by utilizing machine learning techniques. The Frequent Pattern Growth (FP-Growth) algorithm is used as a feature transformation method and the multivariate Bernoulli na{\""\i}ve Bayes classification model as the classifier. To find the correlation that exists between the hearing thresholds and symptoms of hearing loss, the FP-Growth and association rule algorithms were first used to experiment with small sample and large sample datasets. The result of these two experiments showed the existence of this relationship, and that the performance of the hybrid of the FP-Growth and na{\""\i}ve Bayes algorithms in identifying hearing-loss symptoms was found to be efficient, with a very small error rate. The average accuracy rate and average error rate for the multivariate Bernoulli model with FP-Growth feature transformation, using five training sets, are 98.25\% and 1.73\%, respectively.}",2021,https://doi.org/10.3390/su13105406,,Mohd Khanapi Abd Ghani AND Nasir G. Noma AND Mazin Abed Mohammed AND Karrar Hameed Abdulkareem AND Begonya Garcia-Zapirain AND Mashael S. Maashi AND Salama A. Mostafa,{Innovative Artificial Intelligence Approach for Hearing-Loss Symptoms Identification Model Using Machine Learning Techniques},misc,06fe4d8387ec01609152b04cdfc03887f18094b39aeedf0d3f45812e7a44c757,,
{EN},{hearing-loss symptoms},"{Source: Sustainability, Vol 13, Iss 5406, p 5406 (2021) ; Description: Physicians depend on their insight and experience and on a fundamentally indicative or symptomatic approach to decide on the possible ailment of a patient. However, numerous phases of problem identification and longer strategies can prompt a longer time for consulting and can subsequently cause other patients that require attention to wait for longer. This can bring about pressure and tension concerning those patients. In this study, we focus on developing a decision-support system for diagnosing the symptoms as a result of hearing loss. The model is implemented by utilizing machine learning techniques. The Frequent Pattern Growth (FP-Growth) algorithm is used as a feature transformation method and the multivariate Bernoulli na{\""\i}ve Bayes classification model as the classifier. To find the correlation that exists between the hearing thresholds and symptoms of hearing loss, the FP-Growth and association rule algorithms were first used to experiment with small sample and large sample datasets. The result of these two experiments showed the existence of this relationship, and that the performance of the hybrid of the FP-Growth and na{\""\i}ve Bayes algorithms in identifying hearing-loss symptoms was found to be efficient, with a very small error rate. The average accuracy rate and average error rate for the multivariate Bernoulli model with FP-Growth feature transformation, using five training sets, are 98.25\% and 1.73\%, respectively.}",2021,https://doi.org/10.3390/su13105406,{MDPI AG},Mohd Khanapi Abd Ghani AND Nasir G. Noma AND Mazin Abed Mohammed AND Karrar Hameed Abdulkareem AND Begonya Garcia-Zapirain AND Mashael S. Maashi AND Salama A. Mostafa,{Innovative Artificial Intelligence Approach for Hearing-Loss Symptoms Identification Model Using Machine Learning Techniques},article,1d3953ebf37cb3b504828eee1356c2781bd59a6d07fd8e5604d88232c4955a6c,,
{en},{Multidisciplinary},"{Source: Arabian Journal for Science and Engineering ; volume 48, issue 11, page 14883-14899 ; ISSN 2193-567X 2191-4281}",2023,http://dx.doi.org/10.1007/s13369-023-07927-1,{Springer Science and Business Media LLC},"Sankari, V. M. Raja AND Snekhalatha, U. AND Murugappan, M. AND Chowdhury, Muhammad E. H. AND Chamkha, Zeinab A.",{Artificial Intelligence-Based Hearing Loss Detection Using Acoustic Threshold and Speech Perception Level},article,7a4940223e75199d0c3ec54178a93042eb93b1f0ffd127a275252e880aa80978,,
,,"{Description: Physicians depend on their insight and experience and on a fundamentally indicative or symptomatic approach to decide on the possible ailment of a patient. However, numerous phases of problem identification and longer strategies can prompt a longer time for consulting and can subsequently cause other patients that require attention to wait for longer. This can bring about pressure and tension concerning those patients. In this study, we focus on developing a decision-support system for diagnosing the symptoms as a result of hearing loss. The model is implemented by utilizing machine learning techniques. The Frequent Pattern Growth (FP-Growth) algorithm is used as a feature transformation method and the multivariate Bernoulli na{\""\i}ve Bayes classification model as the classifier. To find the correlation that exists between the hearing thresholds and symptoms of hearing loss, the FP-Growth and association rule algorithms were first used to experiment with small sample and large sample datasets. The result of these two experiments showed the existence of this relationship, and that the performance of the hybrid of the FP-Growth and na{\""\i}ve Bayes algorithms in identifying hearing-loss symptoms was found to be efficient, with a very small error rate. The average accuracy rate and average error rate for the multivariate Bernoulli model with FP-Growth feature transformation, using five training sets, are 98.25\% and 1.73\%, respectively. ; hearing-loss symptoms; frequent pattern growth; multivariate Bernoulli na{\""\i}ve Bayes; machine learning techniques; identification model}",,https://www.mdpi.com/2071-1050/13/10/5406/pdf,,Mohd Khanapi Abd Ghani AND Nasir G. Noma AND Mazin Abed Mohammed AND Karrar Hameed Abdulkareem AND Begonya Garcia-Zapirain AND Mashael S. Maashi AND Salama A. Mostafa,{Innovative Artificial Intelligence Approach for Hearing-Loss Symptoms Identification Model Using Machine Learning Techniques},article,a5b4385ce702d812526c42ef9f2ae1b19035c368edbe20d957c9cfe3988733cc,,
{en},"{Public Health, Environmental and Occupational Health}","{Source: International Archives of Occupational and Environmental Health ; volume 88, issue 6, page 779-787 ; ISSN 0340-0131 1432-1246}",2014,http://dx.doi.org/10.1007/s00420-014-1004-z,{Springer Science and Business Media LLC},"Aliabadi, Mohsen AND Farhadian, Maryam AND Darvishi, Ebrahim",{Prediction of hearing loss among the noise-exposed workers in a steel factory using artificial intelligence approach},article,5a61a98a3db23713ad7171e66525e81493e217e2f750c1bf824fdab315fea05a,,
{en},{Speech and Hearing},"{Source: The Hearing Journal ; volume 72, issue 6, page 8,9 ; ISSN 0745-7472}",2019,http://dx.doi.org/10.1097/01.hj.0000558452.52280.9b,{Ovid Technologies (Wolters Kluwer Health)},"Shew, Matthew AND Staecker, Hinrich",{Using Machine Learning to Predict Sensorineural Hearing Loss},article,0450550955d30e032e8f8b74552d710d13dd4a8de0b7c0826e5d2778e65705df,,
{en},{Q Science (General)},"{Description: There is potential knowledge inherent in vast amounts of untapped and possibly valuable data generated by healthcare providers. Clinicians rely in their knowledge and experience and the basic diagnostic procedure to determine the likely symptom of a disease. Sometimes, many stages of diagnosis and longer procedures can leads to longer consultation hours and can consequently results to longer waiting time for other patients that need to be attended to. This can results to stress and anxiety on the part of those patients. This research presents an efficient way to facilitate the hearing loss symptoms diagnosis process by designing a symptoms identification model that efficiently identify hearing loss symptoms based on air and bone conduction pure-tone audiometry data. The model is implemented using both unsupervised and supervised machine learning techniques in the form of Frequent Pattern Growth (FP-Growth) algorithm as feature transformation method and multivariate Bernoulli na{\""\i}ve Bayes classification model as the classifier. In order to find, the correlation that exist between the hearing thresholds and symptoms of hearing loss, FP-Growth and association rule algorithms were first used to experiment with a small sample and large sample datasets. The result of these two experiments showed the existence of this relationship and the performance of the hybrid of the FP-Growth and na{\""\i}ve Bayes algorithms in identifying hearing loss symptoms was found to be efficient with very minimum error rate.}",2014,http://eprints.utem.edu.my/id/eprint/14995/,,Nasiru Garba Noma,{Identification model for hearing loss symptoms using machine learning techniques},misc,9efb3b8e25ec5877aed1e2dc9dea53db002466550b2b4341f125a2ea19b87bb4,,{Thesis}
{en},{Hearing loss},"{Description: University of Toronto ; Objectives: Hearing loss is the most common sensory loss in humans and carries an enhanced risk of depression. No prior studies have attempted a contemporary machine learning approach to predict depression using subjective and objective hearing loss predictors. The objective was to deploy supervised machine learning to predict scores on a validated depression scale using subjective and objective audiometric variables and other health determinant predictors. Design: A large predictor set of health determinants from the National Health and Nutrition Examination Survey 2015{\textendash}2016 database was used to predict adults{\textquoteright} scores on a validated instrument to screen for the presence and severity of depression (Patient Health Questionnaire-9 [PHQ-9]). After model training, the relative influence of individual predictors on depression scores was stratified and analyzed. Model prediction performance was determined by prediction error metrics. Results: The test set mean absolute error was 3.03 (95\% confidence interval: 2.91 to 3.14) and 2.55 (95\% confidence interval: 2.48 to 2.62) on datasets with audiology-only predictors and all predictors, respectively, on the PHQ-9{\textquoteright}s 27-point scale. Participants{\textquoteright} self-reported frustration when talking to members of family or friends due to hearing loss was the fifth-most influential of all predictors. Of the top 10 most influential audiometric predictors, five were related to social contexts, two for significant noise exposure, two objective audiometric parameters, and one presence of bothersome tinnitus. Conclusions: Machine learning algorithms can accurately predict PHQ-9 depression scale scores from National Health and Nutrition Examination Survey data. The most influential audiometric predictors of higher scores on a validated depression scale were social dynamics of hearing loss and not objective audiometric testing. Such models could be useful in predicting depression scale scores at the point-of-care in conjunction with a standard audiologic assessment.}",2021,http://hdl.handle.net/1807/106608,,"Crowson, Matthew G AND Franck, Kevin H AND Rosella, Laura C AND Chan, Timothy C Y",{Predicting Depression From Hearing Loss Using Machine Learning},misc,0f81e5dfe7857e646ffd63e83e817d1f578fd36efd770bc906481bef510637b3,,
{en},{Speech and Hearing},"{Source: Ear & Hearing ; volume 42, issue 4, page 982-989 ; ISSN 1538-4667 ; Description: Objectives: Hearing loss is the most common sensory loss in humans and carries an enhanced risk of depression. No prior studies have attempted a contemporary machine learning approach to predict depression using subjective and objective hearing loss predictors. The objective was to deploy supervised machine learning to predict scores on a validated depression scale using subjective and objective audiometric variables and other health determinant predictors. Design: A large predictor set of health determinants from the National Health and Nutrition Examination Survey 2015{\textendash}2016 database was used to predict adults{\textquoteright} scores on a validated instrument to screen for the presence and severity of depression (Patient Health Questionnaire-9 [PHQ-9]). After model training, the relative influence of individual predictors on depression scores was stratified and analyzed. Model prediction performance was determined by prediction error metrics. Results: The test set mean absolute error was 3.03 (95\% confidence interval: 2.91 to 3.14) and 2.55 (95\% confidence interval: 2.48 to 2.62) on datasets with audiology-only predictors and all predictors, respectively, on the PHQ-9{\textquoteright}s 27-point scale. Participants{\textquoteright} self-reported frustration when talking to members of family or friends due to hearing loss was the fifth-most influential of all predictors. Of the top 10 most influential audiometric predictors, five were related to social contexts, two for significant noise exposure, two objective audiometric parameters, and one presence of bothersome tinnitus. Conclusions: Machine learning algorithms can accurately predict PHQ-9 depression scale scores from National Health and Nutrition Examination Survey data. The most influential audiometric predictors of higher scores on a validated depression scale were social dynamics of hearing loss and not objective audiometric testing. Such models could be useful in predicting depression scale scores at the point-of-care in conjunction with a standard audiologic assessment.}",2021,http://dx.doi.org/10.1097/aud.0000000000000993,{Ovid Technologies (Wolters Kluwer Health)},"Crowson, Matthew G. AND Franck, Kevin H. AND Rosella, Laura C. AND Chan, Timothy C. Y.",{Predicting Depression From Hearing Loss Using Machine Learning},article,ade0f3a38984d43f1b262c79938ec6d866f50b8c25633ee1f1431224ce907dda,,
{en},,"{Description: A research report submitted in partial fulfilment of the requirements for the degree Master of Arts in eScience to the Faculty of Humanities, School of Social Sciences, University of the Witwatersrand, 2021 ; Deafness is one of the most commonly occurring birth conditions in children worldwide creating an increasingly significant global health concern. Failure to early identify hearing loss and provide subsequent intervention services will likely have negative consequences on language, cognition, and socio-emotional development. Current approaches in detecting neonatal hearing loss are limited specifically in developing countries such as South Africa. Machine learning offers an opportunity to create models which could predict the likelihood of a hearing loss occurring in high-risk neonates allowing for early identification and intervention to occur. Thus, the main aim of the current study was to use predictive modelling to predict the likelihood of hearing loss in high-risk neonates. The study sample comprised of 12 044 male and female hearing and deaf and/or hard-of-hearing South African children who either formed part of the HI HOPES or universal newborn screening programme implemented at the Netcare Hospital Group. A nonexperimental, predictive modelling design was employed for the purpose of the current study. Predictive variables used in the current study included mode of delivery, prematurity, gestational age, family history of hearing loss, extracorporeal membrane oxygenation (ECMO), in-utero infections, craniofacial anomalies, physical findings, syndromes associated with hearing loss, neurodegenerative disorders, cultural-positive infections, meningitis, maternal and/or infant HIV infection, and ototoxic medication. The results from several Chi-Square (X 2 ) analyses showed significant correlations between each birth type (i.e., natural, elective caesarean, emergency caesarean), prematurity, family history, ECMO, in-utero infection, craniofacial anomalies, physical findings, syndromes associated with ...}",2021,https://hdl.handle.net/10539/33857,,"Ismail, Safiyyah",{Detecting hearing loss in high-risk neonates using machine learning},misc,fb961a501a1ad53fc0ff41c44c4037706d411d7fa522533bcb30c8b0f49189b4,,{Thesis}
{EN},{sudden hearing loss},"{Source: Clinical and Experimental Otorhinolaryngology, Vol 13, Iss 2, Pp 148-156 (2020) ; Description: Objectives. Prognosticating idiopathic sudden sensorineural hearing loss (ISSNHL) is an important challenge. In our study, a dataset was split into training and test sets and cross-validation was implemented on the training set, thereby determining the hyperparameters for machine learning models with high test accuracy and low bias. The effectiveness of the following five machine learning models for predicting the hearing prognosis in patients with ISSNHL after 1 month of treatment was assessed: adaptive boosting, K-nearest neighbor, multilayer perceptron, random forest (RF), and support vector machine (SVM). Methods. The medical records of 523 patients with ISSNHL admitted to Korea University Ansan Hospital between January 2010 and October 2017 were retrospectively reviewed. In this study, we analyzed data from 227 patients (recovery, 106; no recovery, 121) after excluding those with missing data. To determine risk factors, statistical hypothesis tests (e.g., the two-sample t-test for continuous variables and the chi-square test for categorical variables) were conducted to compare patients who did or did not recover. Variables were selected using an RF model depending on two criteria (mean decreases in the Gini index and accuracy). Results. The SVM model using selected predictors achieved both the highest accuracy (75.36\%) and the highest F-score (0.74) on the test set. The RF model with selected variables demonstrated the second-highest accuracy (73.91\%) and F-score (0.74). The RF model with the original variables showed the same accuracy (73.91\%) as that of the RF model with selected variables, but a lower F-score (0.73). All the tested models, except RF, demonstrated better performance after variable selection based on RF. Conclusion. The SVM model with selected predictors was the best-performing of the tested prediction models. The RF model with selected predictors was the second-best model. Therefore, machine learning models can be used to predict hearing recovery in patients with ISSNHL.}",2020,https://doi.org/10.21053/ceo.2019.01858,{Korean Society of Otorhinolaryngology-Head and Neck Surgery},Keon Vin Park AND Kyoung Ho Oh AND Yong Jun Jeong AND Jihye Rhee AND Mun Soo Han AND Sung Won Han AND June Choi,{Machine Learning Models for Predicting Hearing Prognosis in Unilateral Idiopathic Sudden Sensorineural Hearing Loss},article,b790b3454f62fd6dcf0f064b80c111ee4b834caff76a2f1da923873d9dfe116d,,
