language,keywords,note,year,url,publisher,author,title,ENTRYTYPE,ID,contributor,howpublished
,,"{Description: University of Liverpool ; Time Series Clustering Analysis: Exploring the Patterns of Hearing Loss in Adults (50+) in Cheshire and Merseyside ICS, 2013-2022 For more detailed information on this type of spatial analysis, please visit https://pro.arcgis.com/en/pro-app/latest/tool-reference/space-time-pattern-mining/time-series-clustering.htm ...}",2023,https://dx.doi.org/10.17638/datacat.liverpool.ac.uk/2277,,"Tsimpida, Dialechti","{Time Series Clustering Analysis: Exploring the Patterns of Hearing Loss in Adults (50 years old and above) in Cheshire and Merseyside ICS, 2013-2022. An Interactive Map Application. ...}",misc,724d899471958f0788805b76b94d2f10cfd10ebe0996dfe178df325e3c4ac82f,,
{en},,,2023,https://eprints.soton.ac.uk/484684/,,"Tsimpida, Dalia","{Time series clustering analysis: exploring the patterns of hearing loss in adults (50 years old and above) in Cheshire and Merseyside ICS, 2013-2022. An interactive map application}",misc,73f9e963d275f9d807d119fef69408f4ea5cf070856c424606850c6dd3162c3f,,
{EN},{hearing-loss symptoms},"{Source: Sustainability; Volume 13; Issue 10; Pages: 5406 ; Description: Multidisciplinary Digital Publishing Institute ; Physicians depend on their insight and experience and on a fundamentally indicative or symptomatic approach to decide on the possible ailment of a patient. However, numerous phases of problem identification and longer strategies can prompt a longer time for consulting and can subsequently cause other patients that require attention to wait for longer. This can bring about pressure and tension concerning those patients. In this study, we focus on developing a decision-support system for diagnosing the symptoms as a result of hearing loss. The model is implemented by utilizing machine learning techniques. The Frequent Pattern Growth (FP-Growth) algorithm is used as a feature transformation method and the multivariate Bernoulli na{\""\i}ve Bayes classification model as the classifier. To find the correlation that exists between the hearing thresholds and symptoms of hearing loss, the FP-Growth and association rule algorithms were first used to experiment with small sample and large sample datasets. The result of these two experiments showed the existence of this relationship, and that the performance of the hybrid of the FP-Growth and na{\""\i}ve Bayes algorithms in identifying hearing-loss symptoms was found to be efficient, with a very small error rate. The average accuracy rate and average error rate for the multivariate Bernoulli model with FP-Growth feature transformation, using five training sets, are 98.25\% and 1.73\%, respectively.}",2021,https://doi.org/10.3390/su13105406,,Mohd Khanapi Abd Ghani AND Nasir G. Noma AND Mazin Abed Mohammed AND Karrar Hameed Abdulkareem AND Begonya Garcia-Zapirain AND Mashael S. Maashi AND Salama A. Mostafa,{Innovative Artificial Intelligence Approach for Hearing-Loss Symptoms Identification Model Using Machine Learning Techniques},misc,06fe4d8387ec01609152b04cdfc03887f18094b39aeedf0d3f45812e7a44c757,,
{EN},{hearing-loss symptoms},"{Source: Sustainability, Vol 13, Iss 5406, p 5406 (2021) ; Description: Physicians depend on their insight and experience and on a fundamentally indicative or symptomatic approach to decide on the possible ailment of a patient. However, numerous phases of problem identification and longer strategies can prompt a longer time for consulting and can subsequently cause other patients that require attention to wait for longer. This can bring about pressure and tension concerning those patients. In this study, we focus on developing a decision-support system for diagnosing the symptoms as a result of hearing loss. The model is implemented by utilizing machine learning techniques. The Frequent Pattern Growth (FP-Growth) algorithm is used as a feature transformation method and the multivariate Bernoulli na{\""\i}ve Bayes classification model as the classifier. To find the correlation that exists between the hearing thresholds and symptoms of hearing loss, the FP-Growth and association rule algorithms were first used to experiment with small sample and large sample datasets. The result of these two experiments showed the existence of this relationship, and that the performance of the hybrid of the FP-Growth and na{\""\i}ve Bayes algorithms in identifying hearing-loss symptoms was found to be efficient, with a very small error rate. The average accuracy rate and average error rate for the multivariate Bernoulli model with FP-Growth feature transformation, using five training sets, are 98.25\% and 1.73\%, respectively.}",2021,https://doi.org/10.3390/su13105406,{MDPI AG},Mohd Khanapi Abd Ghani AND Nasir G. Noma AND Mazin Abed Mohammed AND Karrar Hameed Abdulkareem AND Begonya Garcia-Zapirain AND Mashael S. Maashi AND Salama A. Mostafa,{Innovative Artificial Intelligence Approach for Hearing-Loss Symptoms Identification Model Using Machine Learning Techniques},article,1d3953ebf37cb3b504828eee1356c2781bd59a6d07fd8e5604d88232c4955a6c,,
,{Otorhinolaryngology},"{Description: Background:Machine Learning models have been applied in various healthcare fields, including Audiology, to predict disease outcomes. The prognosis of sudden sensorineural hearing loss is difficult to predict due to the variable course of the disease. Hence, researchers have attempted to utilize ML models to predict the outcome of patients with sudden sensorineural hearing loss. The objectives of this study were to review the performance of these machine learning models and assess their applicability in real-world settings.Methods:A systematic search was conducted in PubMed, Web of Science and Scopus. Only studies that built machine learning prediction models were included, and studies that used algorithms such as logistic regression only for the purpose of adjusting for confounding variables were excluded. The risk of bias was assessed using the Prediction model Risk of Bias Assessment Tool (PROBAST).Results:After screening, a total of 7 papers were eligible for synthesis. In total, these studies built 48 ML ...}",2023,https://dx.doi.org/10.25384/sage.c.6892035.v1,{SAGE Journals},"Aghakhani, Amirhossein AND Yousefi, Milad AND Yekaninejad, Mir Saeed",{Machine Learning Models for Predicting Sudden Sensorineural Hearing Loss Outcome: A Systematic Review ...},article,9f7ce94375313f0da7c74edfd0486a495e817f7721e6f72b6dfb3134c278178a,,
{en},{Neurology (clinical)},"{Source: Otology & Neurotology ; volume 42, issue 9, page e1286-e1292 ; ISSN 1531-7129 1537-4505 ; Description: Objectives: Vibrant Soundbridge (VSB) was developed for treatment of hearing loss, but clinical outcomes vary and prognostic factors predicting the success of the treatment remain unknown. We examined clinical outcomes of VSB for conductive or mixed hearing loss, prognostic factors by analyzing prediction models, and cut-off values to predict the outcomes. Study design: Retrospective chart review. Setting: Tertiary care hospital. Patients: Thirty patients who underwent VSB surgery from January 2017 to December 2019 at our hospital. Intervention: Audiological tests were performed prior to and 3 months after surgery; patients completed questionnaires 3 months after surgery. Main outcome measures: We used a multiregression and the random forest algorithm for predictions. Mean absolute errors and coefficient of determinations were calculated to estimate prediction accuracies. Coefficient values in the multiregression model and the importance of features in the random forest model were calculated to clarify prognostic factors. Receiver operation characteristic curves were plotted. Results: All audiological outcomes improved after surgery. The random forest model (mean absolute error: 0.06) recorded more accuracy than the multiregression model (mean absolute error: 0.12). Speech discrimination score in a silent context in patients with hearing aids was the most influential factor (coefficient value: 0.51, featured value: 0.71). The candidate cut-off value was 36\% (sensitivity: 89\%, specificity: 75\%). Conclusions: VSB is an effective treatment for conductive or mixed hearing loss. Machine learning demonstrated more precise predictions, and speech discrimination scores in a silent context in patients with hearing aids were the most important factor in predicting clinical outcomes.}",2021,http://dx.doi.org/10.1097/mao.0000000000003271,{Ovid Technologies (Wolters Kluwer Health)},"Koyama, Hajime AND Mori, Anjin AND Nagatomi, Daisuke AND Fujita, Takeshi AND Saito, Kazuya AND Osaki, Yasuhiro AND Yamasoba, Tatsuya AND Doi, Katsumi",{Machine Learning Technique Reveals Prognostic Factors of Vibrant Soundbridge for Conductive or Mixed Hearing Loss Patients},article,6d5e172708d488f744dfcb2aa66e224591f39dbaa0cbd4d4f5caa2eae8960d6f,,
{en},{Multidisciplinary},"{Source: Scientific Reports ; volume 9, issue 1 ; ISSN 2045-2322 ; Description: Abstract Hearing loss (HL) is the most common neurodegenerative disease worldwide. Despite its prevalence, clinical testing does not yield a cell or molecular based identification of the underlying etiology of hearing loss making development of pharmacological or molecular treatments challenging. A key to improving the diagnosis of inner ear disorders is the development of reliable biomarkers for different inner ear diseases. Analysis of microRNAs (miRNA) in tissue and body fluid samples has gained significant momentum as a diagnostic tool for a wide variety of diseases. In previous work, we have shown that miRNA profiling in inner ear perilymph is feasible and may demonstrate distinctive miRNA expression profiles unique to different diseases. A first step in developing miRNAs as biomarkers for inner ear disease is linking patterns of miRNA expression in perilymph to clinically available metrics. Using machine learning (ML), we demonstrate we can build disease specific algorithms that predict the presence of sensorineural hearing loss using only miRNA expression profiles. This methodology not only affords the opportunity to understand what is occurring on a molecular level, but may offer an approach to diagnosing patients with active inner ear disease.}",2019,http://dx.doi.org/10.1038/s41598-019-40192-7,{Springer Science and Business Media LLC},"Shew, Matthew AND New, Jacob AND Wichova, Helena AND Koestler, Devin C. AND Staecker, Hinrich",{Using Machine Learning to Predict Sensorineural Hearing Loss Based on Perilymph Micro RNA Expression Profile},article,aec94d0092b6b0db052420717ec1d2f34246ba2f77f955283317701e677caa44,,
,{Otorhinolaryngology},"{Description: Background:Machine Learning models have been applied in various healthcare fields, including Audiology, to predict disease outcomes. The prognosis of sudden sensorineural hearing loss is difficult to predict due to the variable course of the disease. Hence, researchers have attempted to utilize ML models to predict the outcome of patients with sudden sensorineural hearing loss. The objectives of this study were to review the performance of these machine learning models and assess their applicability in real-world settings.Methods:A systematic search was conducted in PubMed, Web of Science and Scopus. Only studies that built machine learning prediction models were included, and studies that used algorithms such as logistic regression only for the purpose of adjusting for confounding variables were excluded. The risk of bias was assessed using the Prediction model Risk of Bias Assessment Tool (PROBAST).Results:After screening, a total of 7 papers were eligible for synthesis. In total, these studies built 48 ML ...}",2023,https://dx.doi.org/10.25384/sage.c.6892035,{SAGE Journals},"Aghakhani, Amirhossein AND Yousefi, Milad AND Yekaninejad, Mir Saeed",{Machine Learning Models for Predicting Sudden Sensorineural Hearing Loss Outcome: A Systematic Review ...},article,b576fb8d37b8d90c7c9c455431e3fe2f69b03df6006a199639239234ce895e29,,
{en},{Article},"{Description: Nature Publishing Group UK ; Hearing loss (HL) is the most common neurodegenerative disease worldwide. Despite its prevalence, clinical testing does not yield a cell or molecular based identification of the underlying etiology of hearing loss making development of pharmacological or molecular treatments challenging. A key to improving the diagnosis of inner ear disorders is the development of reliable biomarkers for different inner ear diseases. Analysis of microRNAs (miRNA) in tissue and body fluid samples has gained significant momentum as a diagnostic tool for a wide variety of diseases. In previous work, we have shown that miRNA profiling in inner ear perilymph is feasible and may demonstrate distinctive miRNA expression profiles unique to different diseases. A first step in developing miRNAs as biomarkers for inner ear disease is linking patterns of miRNA expression in perilymph to clinically available metrics. Using machine learning (ML), we demonstrate we can build disease specific algorithms that predict the presence of sensorineural hearing loss using only miRNA expression profiles. This methodology not only affords the opportunity to understand what is occurring on a molecular level, but may offer an approach to diagnosing patients with active inner ear disease.}",2019,http://www.ncbi.nlm.nih.gov/pmc/articles/PMC6399453/,,"Shew, Matthew AND New, Jacob AND Wichova, Helena AND Koestler, Devin C. AND Staecker, Hinrich",{Using Machine Learning to Predict Sensorineural Hearing Loss Based on Perilymph Micro RNA Expression Profile},misc,2cb86643f4d798d1b9ccdde22669a0f0ca7c088f69cfd62c8df91b09e7f45fa8,,
,,"{Source: 2022 6th International Conference On Computing, Communication, Control And Automation (ICCUBEA}",2022,http://dx.doi.org/10.1109/iccubea54992.2022.10011011,{IEEE},"Vanjari, Hrishikesh B. AND Kolte, Mahesh T. AND Chopade, Nilkanth",{Hearing Loss Adaptivity of Machine Learning Based Compressive Sensing Speech Enhancement for Hearing Aids},proceedings,38ca22a5336fb7a354b07792638fb5e008086ecca2c928550315a1b1779cb046,,
{en},{Otorhinolaryngology},"{Source: American Journal of Otolaryngology ; volume 42, issue 2, page 102858 ; ISSN 0196-0709}",2021,http://dx.doi.org/10.1016/j.amjoto.2020.102858,{Elsevier BV},"Uhm, Taewoong AND Lee, Jae Eun AND Yi, Seongbaek AND Choi, Sung Won AND Oh, Se Joon AND Kong, Soo Keun AND Lee, Il Woo AND Lee, Hyun Min",{Predicting hearing recovery following treatment of idiopathic sudden sensorineural hearing loss with machine learning models},article,807977baddc889dff3a0efb652625cc4a5b1eda463b4f2794d1617389e5075b1,{Pusan National University Yangsan Hospital},
{en},,"{Description: Article published in International Archives of Occupational and Environmental Health available open access at https://doi.org/10.1007/s00420-020-01648-w ; Purpose Noise-induced hearing loss (NIHL) is a global issue that impacts people{\textquoteright}s life and health. The current review aims to clarify the contributions and limitations of applying machine learning (ML) to predict NIHL by analyzing the performance of different ML techniques and the procedure of model construction. Methods The authors searched PubMed, EMBASE and Scopus on November 26, 2020. Results Eight studies were recruited in the current review following defined inclusion and exclusion criteria. Sample size in the selected studies ranged between 150 and 10,567. The most popular models were artificial neural networks (n = 4), random forests (n = 3) and support vector machines (n = 3). Features mostly correlated with NIHL and used in the models were: age (n = 6), duration of noise exposure (n = 5) and noise exposure level (n = 4). Five included studies used either split-sample validation (n = 3) or ten-fold cross-validation (n = 2). Assessment of accuracy ranged in value from 75.3\% to 99\% with a low prediction error/root-mean-square error in 3 studies. Only 2 studies measured discrimination risk using the receiver operating characteristic (ROC) curve and/or the area under ROC curve. Conclusion In spite of high accuracy and low prediction error of machine learning models, some improvement can be expected from larger sample sizes, multiple algorithm use, completed reports of model construction and the sufficient evaluation of calibration and discrimination risk.}",2021,http://hdl.handle.net/10369/11272,{Springer},"Chen, Feifan AND Cao, Zuwei AND Grais, Emad M. AND Zhao, Fei",{Contributions and limitations of using machine learning to predict noise-induced hearing loss},article,98587f908f12fa1d83fff6aea9e50752ad9d10a9c7f4fb278c73c46496e3ee57,,
,,"{Description: Physicians depend on their insight and experience and on a fundamentally indicative or symptomatic approach to decide on the possible ailment of a patient. However, numerous phases of problem identification and longer strategies can prompt a longer time for consulting and can subsequently cause other patients that require attention to wait for longer. This can bring about pressure and tension concerning those patients. In this study, we focus on developing a decision-support system for diagnosing the symptoms as a result of hearing loss. The model is implemented by utilizing machine learning techniques. The Frequent Pattern Growth (FP-Growth) algorithm is used as a feature transformation method and the multivariate Bernoulli na{\""\i}ve Bayes classification model as the classifier. To find the correlation that exists between the hearing thresholds and symptoms of hearing loss, the FP-Growth and association rule algorithms were first used to experiment with small sample and large sample datasets. The result of these two experiments showed the existence of this relationship, and that the performance of the hybrid of the FP-Growth and na{\""\i}ve Bayes algorithms in identifying hearing-loss symptoms was found to be efficient, with a very small error rate. The average accuracy rate and average error rate for the multivariate Bernoulli model with FP-Growth feature transformation, using five training sets, are 98.25\% and 1.73\%, respectively. ; hearing-loss symptoms; frequent pattern growth; multivariate Bernoulli na{\""\i}ve Bayes; machine learning techniques; identification model}",,https://www.mdpi.com/2071-1050/13/10/5406/pdf,,Mohd Khanapi Abd Ghani AND Nasir G. Noma AND Mazin Abed Mohammed AND Karrar Hameed Abdulkareem AND Begonya Garcia-Zapirain AND Mashael S. Maashi AND Salama A. Mostafa,{Innovative Artificial Intelligence Approach for Hearing-Loss Symptoms Identification Model Using Machine Learning Techniques},article,a5b4385ce702d812526c42ef9f2ae1b19035c368edbe20d957c9cfe3988733cc,,
,,{Source: 2019 15th International Conference on Signal-Image Technology & Internet-Based Systems (SITIS)},2019,http://dx.doi.org/10.1109/sitis.2019.00034,{IEEE},"Ilyas, Muhammad AND Nait-ali, Amine",{Machine Learning Based Detection of Hearing Loss Using Auditory Perception Responses},proceedings,990378f3fe801ebf21b4a29eec57474ce12bf7f7a975b8f8aa1459816e3035b4,,
{en},{General Medicine},"{Source: Annals of Otology, Rhinology & Laryngology ; volume 133, issue 3, page 268-276 ; ISSN 0003-4894 1943-572X ; Description: Background: Machine Learning models have been applied in various healthcare fields, including Audiology, to predict disease outcomes. The prognosis of sudden sensorineural hearing loss is difficult to predict due to the variable course of the disease. Hence, researchers have attempted to utilize ML models to predict the outcome of patients with sudden sensorineural hearing loss. The objectives of this study were to review the performance of these machine learning models and assess their applicability in real-world settings. Methods: A systematic search was conducted in PubMed, Web of Science and Scopus. Only studies that built machine learning prediction models were included, and studies that used algorithms such as logistic regression only for the purpose of adjusting for confounding variables were excluded. The risk of bias was assessed using the Prediction model Risk of Bias Assessment Tool (PROBAST). Results: After screening, a total of 7 papers were eligible for synthesis. In total, these studies built 48 ML models. The most common utilized algorithms were Logistic Regression, Support Vector Machine (SVM) and boosting. The area under the curve of the receiver operating characteristic curve ranged between 0.59 and 0.915. All of the included studies had a high risk of bias; hence there are concerns regarding their applicability. Conclusion: Although these models showed great performance and promising results, future studies are still needed before these models can be applied in a real-world setting. Future studies should employ multiple cohorts, different feature selection methods, and external validation to further validate the models{\textquoteright} applicability.}",2023,http://dx.doi.org/10.1177/00034894231206902,{SAGE Publications},"Aghakhani, Amirhossein AND Yousefi, Milad AND Yekaninejad, Mir Saeed",{Machine Learning Models for Predicting Sudden Sensorineural Hearing Loss Outcome: A Systematic Review},article,eb3215291a18f23128793edf022632920d7ca9ab8fe9de428adda9767fffa3c1,,
{en},,"{Description: Article published in International Archives of Occupational and Environmental Health available open access at https://doi.org/10.1007/s00420-020-01648-w ; Purpose Noise-induced hearing loss (NIHL) is a global issue that impacts people{\textquoteright}s life and health. The current review aims to clarify the contributions and limitations of applying machine learning (ML) to predict NIHL by analyzing the performance of different ML techniques and the procedure of model construction. Methods The authors searched PubMed, EMBASE and Scopus on November 26, 2020. Results Eight studies were recruited in the current review following defined inclusion and exclusion criteria. Sample size in the selected studies ranged between 150 and 10,567. The most popular models were artificial neural networks (n = 4), random forests (n = 3) and support vector machines (n = 3). Features mostly correlated with NIHL and used in the models were: age (n = 6), duration of noise exposure (n = 5) and noise exposure level (n = 4). Five included studies used either split-sample validation (n = 3) or ten-fold cross-validation (n = 2). Assessment of accuracy ranged in value from 75.3\% to 99\% with a low prediction error/root-mean-square error in 3 studies. Only 2 studies measured discrimination risk using the receiver operating characteristic (ROC) curve and/or the area under ROC curve. Conclusion In spite of high accuracy and low prediction error of machine learning models, some improvement can be expected from larger sample sizes, multiple algorithm use, completed reports of model construction and the sufficient evaluation of calibration and discrimination risk.}",2021,http://hdl.handle.net/10369/11272,{Springer},"Chen, Feifan AND Cao, Zuwei AND Grais, Emad M. AND Zhao, Fei",{Contributions and limitations of using machine learning to predict noise-induced hearing loss},article,98587f908f12fa1d83fff6aea9e50752ad9d10a9c7f4fb278c73c46496e3ee57,,
,,{Source: 2022 IEEE North Karnataka Subsection Flagship International Conference (NKCon)},2022,http://dx.doi.org/10.1109/nkcon56289.2022.10127090,{IEEE},"Pai K, Venkataramana AND Thilagam, P. Santhi","{Hearing Loss Prediction in Newborns, Infants and Toddlers using Machine Learning}",proceedings,b9a28b6c6155ae286523aaf5c6abe241dc3e2bec0a63ab17fd7c48d9ca09911f,,
{en},{[INFO]Computer Science [cs]},"{Source: 2019 15th International Conference on Signal-Image Technology & Internet-Based Systems (SITIS) ; https://hal.u-pec.fr/hal-04323908 ; 2019 15th International Conference on Signal-Image Technology & Internet-Based Systems (SITIS), Nov 2019, Sorrento, Italy. pp.146-150, &#x27E8;10.1109/SITIS.2019.00034&#x27E9; ; Description: International audience}",2019,https://hal.u-pec.fr/hal-04323908,"{HAL CCSD, IEEE}","Ilyas, Muhammad AND Nait-Ali, Amine",{Machine Learning Based Detection of Hearing Loss Using Auditory Perception Responses},proceedings,7030568dd2c40f23b8e9fcfb94637a1153b900324ff229345941d21f66a04c31,"{Laboratoire Images, Signaux et Syst{\`e}mes Intelligents (LISSI)}",
,{Gene Sequencing},"{Description: This is the Supporting Datasets for the manuscript ""Machine learning-based genetic diagnosis models for hereditary hearing loss by the GJB2, SLC26A4 and MT-RNR1 mutations"" by Luo et al in EBiomedicine . The two data sets were processed sequencing data, of which the Discovery Set was from the medical records and the Validation Set was from the Disabled Persons{\textquoteright} Federation. PS: No mutations found were indicated by 0, heterozygous mutations by 1, and homozygous mutations by 2}",2021,https://doi.org/10.17632/6mh8mpnbgv.1,,xiao mei luo (10220563),"{Data for: Machine learning-based genetic diagnosis models for hereditary hearing loss by the GJB2, SLC26A4 and MT-RNR1 mutations}",misc,5648b6206dab65e05090dbd61a9a1f9a9e2360b19dad8071c07ef64e5845e267,,
,{Gene Sequencing},"{Description: Mendeley ; This is the Supporting Datasets for the manuscript ""Machine learning-based genetic diagnosis models for hereditary hearing loss by the GJB2, SLC26A4 and MT-RNR1 mutations"" by Luo et al in EBiomedicine . The two data sets were processed sequencing data, of which the Discovery Set was from the medical records and the Validation Set was from the Disabled Persons{\textquoteright} Federation. PS: No mutations found were indicated by 0, heterozygous mutations by 1, and homozygous mutations by 2 ...}",2021,https://dx.doi.org/10.17632/6mh8mpnbgv.1,,"Luo, Xiao Mei","{Data for: Machine learning-based genetic diagnosis models for hereditary hearing loss by the GJB2, SLC26A4 and MT-RNR1 mutations ...}",misc,31f0914625ebd40b52b14336882d28b853967644107e14e241aaad4f8f18c445,,
