language,keywords,note,year,url,publisher,author,title,ENTRYTYPE,ID,contributor,howpublished
{en},{Otorhinolaryngology},"{Source: Otolaryngologyâ€“Head and Neck Surgery ; volume 169, issue 3, page 504-513 ; ISSN 0194-5998 1097-6817 ; Description: Abstract Objective Hearing loss (HL) is highly prevalent, yet underrecognized and underdiagnosed. Lack of standardized screening, awareness, cost, and access to hearing testing present barriers to HL identification. To facilitate prescreening and selection of patients who warrant audiometric evaluation, we developed a machine learning (ML) model to predict speech-frequency pure-tone average (PTA). Study Design Cross-sectional study. Setting National Health and Nutrition Examination Survey (NHANES). Methods The cohort included 8918 adults (>=20 years) who completed audiometric testing with NHANES (2012-2018). The primary outcome measure was the prediction of better hearing ear speech-frequency PTA. Relevant predictors included demographics, medical conditions, and subjective assessment of hearing. Supervised ML with a tree-based architecture was used. Regression performance was determined by the mean absolute error (MAE) with binary classification assessed with area under the receiver operating characteristic curve (AUC). Results Using the full set of predictors, the test set MAE between the ML-predicted and actual PTA was 5.29 dB HL (95\% confidence interval [CI]: 4.97-5.61). The 5 most influential predictors of higher PTA were increased age, worse subjective hearing, male gender, increased body mass index, and history of smoking. The 5-factor abbreviated model performed comparably to the extended feature set with MAE 5.36 (95\% CI: 5.03-5.69) and AUC for PTA > 25 dB HL of 0.92 (95\% CI: 0.90-0.94). Conclusion The ML model was able to predict PTA with patient demographics, clinical factors, and subjective hearing status. ML-based prediction may be used to identify individuals who could benefit most from audiometric evaluation.}",2023,http://dx.doi.org/10.1002/ohn.288,{Wiley},"Gathman, Tyler J. AND Choi, Janet S. AND Vasdev, Ranveer M.S. AND Schoephoerster, Jamee A. AND Adams, Meredith E.","{Machine Learning Prediction of Objective Hearing Loss With Demographics, Clinical Factors, and Subjective Hearing Status}",article,a39e8777d5fda8d6afad8d3fe56185a984361bcf4ce669d953067ea443998251,,
{en},{Otorhinolaryngology},"{Source: Clinical Otolaryngology ; volume 43, issue 3, page 868-874 ; ISSN 1749-4478 1749-4486 ; Description: Objective Sudden sensorineural hearing loss ( SSHL ) is a multifactorial disorder with high heterogeneity, thus the outcomes vary widely. This study aimed to develop predictive models based on four machine learning methods for SSHL , identifying the best performer for clinical application. Design Single-centre retrospective study. Setting Chinese People{\textquoteright}s liberation army ( PLA ) hospital, Beijing, China. Participants A total of 1220 in-patient SSHL patients were enrolled between June 2008 and December 2015. Main outcome measures An advanced deep learning technique, deep belief network ( DBN ), together with the conventional logistic regression ( LR ), support vector machine ( SVM ) and multilayer perceptron ( MLP ) were developed to predict the dichotomised hearing outcome of SSHL by inputting six feature collections derived from 149 potential predictors. Accuracy, precision, recall, F -score and the area under the receiver operator characteristic curves ( ROC - AUC ) were exploited to compare the prediction performance of different models. Results Overall the best predictive ability was provided by the DBN model when tested in the raw data set with 149 variables, achieving an accuracy of 77.58\% and AUC of 0.84. Nevertheless, DBN yielded inferior performance after feature pruning. In contrast, the LR , SVM and MLP models demonstrated opposite trend as the greatest individual prediction powers were obtained when included merely three variables, with the ROC - AUC ranging from 0.79 to 0.81, and then decreased with the increasing size of input features combinations. Conclusions With the input of enough features, DBN can be a robust prediction tool for SSHL . But LR is more practical for early prediction in routine clinical application using three readily available variables, that is time elapse between symptom onset and study entry, initial hearing level and audiogram.}",2018,http://dx.doi.org/10.1111/coa.13068,{Wiley},"Bing, D. AND Ying, J. AND Miao, J. AND Lan, L. AND Wang, D. AND Zhao, L. AND Yin, Z. AND Yu, L. AND Guan, J. AND Wang, Q.",{Predicting the hearing outcome in sudden sensorineural hearing loss via machine learning models},article,9351be112ef3ba4a47ea91bd0fde47f144b80b20c796e61557766d0af8340db0,{National Natural Science Foundation of China},
{en},"{Public Health, Environmental and Occupational Health}","{Source: International Archives of Occupational and Environmental Health ; volume 94, issue 5, page 1097-1111 ; ISSN 0340-0131 1432-1246 ; Description: Abstract Purpose Noise-induced hearing loss (NIHL) is a global issue that impacts people{\textquoteright}s life and health. The current review aims to clarify the contributions and limitations of applying machine learning (ML) to predict NIHL by analyzing the performance of different ML techniques and the procedure of model construction. Methods The authors searched PubMed, EMBASE and Scopus on November 26, 2020. Results Eight studies were recruited in the current review following defined inclusion and exclusion criteria. Sample size in the selected studies ranged between 150 and 10,567. The most popular models were artificial neural networks ( n = 4), random forests ( n = 3) and support vector machines ( n = 3). Features mostly correlated with NIHL and used in the models were: age ( n = 6), duration of noise exposure ( n = 5) and noise exposure level ( n = 4). Five included studies used either split-sample validation ( n = 3) or ten-fold cross-validation ( n = 2). Assessment of accuracy ranged in value from 75.3\% to 99\% with a low prediction error/root-mean-square error in 3 studies. Only 2 studies measured discrimination risk using the receiver operating characteristic (ROC) curve and/or the area under ROC curve. Conclusion In spite of high accuracy and low prediction error of machine learning models, some improvement can be expected from larger sample sizes, multiple algorithm use, completed reports of model construction and the sufficient evaluation of calibration and discrimination risk.}",2021,http://dx.doi.org/10.1007/s00420-020-01648-w,{Springer Science and Business Media LLC},"Chen, Feifan AND Cao, Zuwei AND Grais, Emad M. AND Zhao, Fei",{Contributions and limitations of using machine learning to predict noise-induced hearing loss},article,97f90608146d34971202581775c69e1f63e52c304528f7755f3ca31a90f7a3d2,{National Natural Science Foundation of China},
{en},{Review Article},"{Source: Int Arch Occup Environ Health ; Description: Springer Berlin Heidelberg ; PURPOSE: Noise-induced hearing loss (NIHL) is a global issue that impacts people{\textquoteright}s life and health. The current review aims to clarify the contributions and limitations of applying machine learning (ML) to predict NIHL by analyzing the performance of different ML techniques and the procedure of model construction. METHODS: The authors searched PubMed, EMBASE and Scopus on November 26, 2020. RESULTS: Eight studies were recruited in the current review following defined inclusion and exclusion criteria. Sample size in the selected studies ranged between 150 and 10,567. The most popular models were artificial neural networks (n = 4), random forests (n = 3) and support vector machines (n = 3). Features mostly correlated with NIHL and used in the models were: age (n = 6), duration of noise exposure (n = 5) and noise exposure level (n = 4). Five included studies used either split-sample validation (n = 3) or ten-fold cross-validation (n = 2). Assessment of accuracy ranged in value from 75.3\% to 99\% with a low prediction error/root-mean-square error in 3 studies. Only 2 studies measured discrimination risk using the receiver operating characteristic (ROC) curve and/or the area under ROC curve. CONCLUSION: In spite of high accuracy and low prediction error of machine learning models, some improvement can be expected from larger sample sizes, multiple algorithm use, completed reports of model construction and the sufficient evaluation of calibration and discrimination risk.}",2021,http://www.ncbi.nlm.nih.gov/pmc/articles/PMC8238747/,,"Chen, Feifan AND Cao, Zuwei AND Grais, Emad M. AND Zhao, Fei",{Contributions and limitations of using machine learning to predict noise-induced hearing loss},misc,b7971ce26b8a8e9d5764d4442c32f627faab4a07a8bf7266a797f67d162bbf72,,
{en},{Article},"{Source: Ear Hear ; Description: OBJECTIVES. A confluence of recent developments in cloud computing, real-time web audio and machine learning psychometric function estimation has made wide dissemination of sophisticated turn-key audiometric assessments possible. The authors have combined these capabilities into an online (i.e., web-based) pure-tone audiogram estimator intended to empower researchers and clinicians with advanced hearing tests without the need for custom programming. The objective of this study is to assess the accuracy and reliability of this new online machine learning audiogram method relative to a commonly used hearing threshold estimation technique also implemented online for the first time in the same platform. DESIGN. The authors performed air-conduction pure-tone audiometry on 21 participants between the ages of 19 and 79 years (mean 41, standard deviation 21) exhibiting a wide range of hearing abilities. For each ear, two repetitions of online machine learning audiogram estimation and two repetitions of online modified Hughson-Westlake ascending-descending audiogram estimation were acquired by an audiologist using the online software tools. The estimated hearing thresholds of these two techniques were compared at standard audiogram frequencies (i.e., 0.25, 0.5, 1, 2, 4, 8 kHz). RESULTS. The two threshold estimation methods delivered very similar threshold estimates at standard audiogram frequencies. Specifically, the mean absolute difference between threshold estimates was 3.24 {\textpm} 5.15 dB. The mean absolute differences between repeated measurements of the online machine learning procedure and between repeated measurements of the Hughson-Westlake procedure were 2.85 {\textpm} 6.57 dB and 1.88 {\textpm} 3.56 respectively. The machine learning method generated estimates of both threshold and spread (i.e., the inverse of psychometric slope) continuously across the entire frequency range tested from fewer samples on average than the modified Hughson-Westlake procedure required to estimate 6 discrete thresholds. CONCLUSIONS. Online machine ...}",2019,http://www.ncbi.nlm.nih.gov/pmc/articles/PMC6476703/,,"Barbour, Dennis L. AND Howard, Rebecca T. AND Song, Xinyu D. AND Metzger, Nikki AND Sukesan, Kiron A. AND DiLorenzo, James C. AND Snyder, Braham R. D. AND Chen, Jeff Y. AND Degen, Eleanor A. AND Buchbinder, Jenna M. AND Heisey, Katherine L.",{Online Machine Learning Audiometry},misc,a7c4618922f24f4bdfd93182b65edd0510b2073a9f2a4a703da70a976ef954f9,,
{en},{Speech and Hearing},"{Source: Ear & Hearing ; volume 40, issue 4, page 918-926 ; ISSN 0196-0202 ; Description: Objectives: A confluence of recent developments in cloud computing, real-time web audio and machine learning psychometric function estimation has made wide dissemination of sophisticated turn-key audiometric assessments possible. The authors have combined these capabilities into an online (i.e., web-based) pure-tone audiogram estimator intended to empower researchers and clinicians with advanced hearing tests without the need for custom programming or special hardware. The objective of this study was to assess the accuracy and reliability of this new online machine learning audiogram method relative to a commonly used hearing threshold estimation technique also implemented online for the first time in the same platform. Design: The authors performed air conduction pure-tone audiometry on 21 participants between the ages of 19 and 79 years (mean 41, SD 21) exhibiting a wide range of hearing abilities. For each ear, two repetitions of online machine learning audiogram estimation and two repetitions of online modified Hughson-Westlake ascending-descending audiogram estimation were acquired by an audiologist using the online software tools. The estimated hearing thresholds of these two techniques were compared at standard audiogram frequencies (i.e., 0.25, 0.5, 1, 2, 4, 8 kHz). Results: The two threshold estimation methods delivered very similar threshold estimates at standard audiogram frequencies. Specifically, the mean absolute difference between threshold estimates was 3.24 {\textpm} 5.15 dB. The mean absolute differences between repeated measurements of the online machine learning procedure and between repeated measurements of the Hughson-Westlake procedure were 2.85 {\textpm} 6.57 dB and 1.88 {\textpm} 3.56 dB, respectively. The machine learning method generated estimates of both threshold and spread (i.e., the inverse of psychometric slope) continuously across the entire frequency range tested from fewer samples on average than the modified Hughson-Westlake procedure required to estimate six discrete thresholds. Conclusions: Online ...}",2018,http://dx.doi.org/10.1097/aud.0000000000000669,{Ovid Technologies (Wolters Kluwer Health)},"Barbour, Dennis L. AND Howard, Rebecca T. AND Song, Xinyu D. AND Metzger, Nikki AND Sukesan, Kiron A. AND DiLorenzo, James C. AND Snyder, Braham R. D. AND Chen, Jeff Y. AND Degen, Eleanor A. AND Buchbinder, Jenna M. AND Heisey, Katherine L.",{Online Machine Learning Audiometry},article,88b7dc44d97ff300a514a86fdd0ce02a4a705982334dcbf84b3ec4310aca5165,,
{en},{Article},"{Source: Ear Hear ; Description: OBJECTIVES: When one ear of an individual can hear significantly better than the other ear, evaluating the worse ear with loud probe tones may require delivering masking noise to the better ear in order to prevent the probe tones from inadvertently being heard by the better ear. Current masking protocols are confusing, laborious and time consuming. Adding a standardized masking protocol to an active machine learning audiogram procedure could potentially alleviate all of these drawbacks by dynamically adapting the masking as needed for each individual. The goal of this study is to determine the accuracy and efficiency of automated machine learning masking for obtaining true hearing thresholds. DESIGN: Dynamically masked automated audiograms were collected for 29 participants between the ages of 21 and 83 (mean 43, SD 20) with a wide range of hearing abilities. Normal hearing listeners were given unmasked and masked machine learning audiogram tests. Listeners with hearing loss were given a standard audiogram test by an audiologist, with masking stimuli added as clinically determined, followed by a masked machine learning audiogram test. The hearing thresholds estimated for each pair of techniques were compared at standard audiogram frequencies (i.e., 0.25, 0.5, 1, 2, 4, 8 kHz). RESULTS: Masked and unmasked machine learning audiogram threshold estimates matched each other well in normal hearing listeners, with a mean absolute difference between threshold estimates of 3.4 dB. Masked machine learning audiogram thresholds also matched well the thresholds determined by a conventional masking procedure, with a mean absolute difference between threshold estimates for listeners with low asymmetry and high asymmetry between the ears, respectively, of 4.9 dB and 2.6 dB. Notably, out of 6200 masked machine learning audiogram tone deliveries for this study, no instances of tones detected by the non test ear were documented. The machine learning methods were also generally faster than the manual methods, and for some ...}",2020,http://www.ncbi.nlm.nih.gov/pmc/articles/PMC7725866/,,"Heisey, Katherine L. AND Walker, Alexandra M. AND Xie, Kevin AND Abrams, Jenna M. AND Barbour, Dennis L.",{Dynamically Masked Audiograms with Machine Learning Audiometry},misc,3e72029d783983f9a26ea2e633fb2dd0616c5f9c26635150253d2e280f3a4dea,,
{en},{Speech and Hearing},"{Source: The Hearing Journal ; volume 74, issue 3, page 40,43,44 ; ISSN 0745-7472}",2021,http://dx.doi.org/10.1097/01.hj.0000737592.24476.88,{Ovid Technologies (Wolters Kluwer Health)},"Barbour, Dennis L. AND Wasmann, Jan-Willem A.",{Performance and Potential of Machine Learning Audiometry},article,cad542bcda71321acdfbc54b789c5e67f51a582969693937b6a03462d47e6b47,,
{en},{Speech and Hearing},"{Source: Ear & Hearing ; volume 41, issue 6, page 1692-1702 ; ISSN 1538-4667 0196-0202 ; Description: Objectives: When one ear of an individual can hear significantly better than the other ear, evaluating the worse ear with loud probe tones may require delivering masking noise to the better ear to prevent the probe tones from inadvertently being heard by the better ear. Current masking protocols are confusing, laborious, and time consuming. Adding a standardized masking protocol to an active machine learning audiogram procedure could potentially alleviate all of these drawbacks by dynamically adapting the masking as needed for each individual. The goal of this study is to determine the accuracy and efficiency of automated machine learning masking for obtaining true hearing thresholds. Design: Dynamically masked automated audiograms were collected for 29 participants between the ages of 21 and 83 (mean 43, SD 20) with a wide range of hearing abilities. Normal-hearing listeners were given unmasked and masked machine learning audiogram tests. Listeners with hearing loss were given a standard audiogram test by an audiologist, with masking stimuli added as clinically determined, followed by a masked machine learning audiogram test. The hearing thresholds estimated for each pair of techniques were compared at standard audiogram frequencies (i.e., 0.25, 0.5, 1, 2, 4, 8 kHz). Results: Masked and unmasked machine learning audiogram threshold estimates matched each other well in normal-hearing listeners, with a mean absolute difference between threshold estimates of 3.4 dB. Masked machine learning audiogram thresholds also matched well the thresholds determined by a conventional masking procedure, with a mean absolute difference between threshold estimates for listeners with low asymmetry and high asymmetry between the ears, respectively, of 4.9 and 2.6 dB. Notably, out of 6200 masked machine learning audiogram tone deliveries for this study, no instances of tones detected by the nontest ear were documented. The machine learning methods were also generally faster than the manual methods, and for some listeners, ...}",2020,http://dx.doi.org/10.1097/aud.0000000000000891,{Ovid Technologies (Wolters Kluwer Health)},"Heisey, Katherine L. AND Walker, Alexandra M. AND Xie, Kevin AND Abrams, Jenna M. AND Barbour, Dennis L.",{Dynamically Masked Audiograms With Machine Learning Audiometry},article,52d5bb287d56eb3a5df4115ba7d346be01cc12c2d4f85d9c5b1bca40ab4afeda,,
,,{Description: Washington University in St. Louis},2017,https://dx.doi.org/10.7936/k77s7n6j,,"Song, Xinyu",{Improving Pure-Tone Audiometry Using Probabilistic Machine Learning Classification ...},misc,f67243d7bf355b68663826c6c99284b6a9b5f39402c0e0b138de2a8c97cdda4e,,
{English (en)},{Audiometry},"{Source: McKelvey School of Engineering Theses & Dissertations ; Description: Washington University Open Scholarship ; Hearing loss is a critical public health concern, affecting hundreds millions of people worldwide and dramatically impacting quality of life for affected individuals. While treatment techniques have evolved in recent years, methods for assessing hearing ability have remained relatively unchanged for decades. The standard clinical procedure is the modified Hughson-Westlake procedure, an adaptive pure-tone detection task that is typically performed manually by audiologists, costing millions of collective hours annually among healthcare professionals. In addition to the high burden of labor, the technique provides limited detail about an individual{\textquoteright}s hearing ability, estimating only detection thresholds at a handful of pre-defined pure-tone frequencies (a threshold audiogram). An efficient technique that produces a detailed estimate of the audiometric function, including threshold and spread, could allow for better characterization of particular hearing pathologies and provide more diagnostic value. Parametric techniques exist to efficiently estimate multidimensional psychometric functions, but are ill-suited for estimation of audiometric functions because these functions cannot be easily parameterized. The Gaussian process is a compelling machine learning technique for inference of nonparametric multidimensional functions using binary data. The work described in this thesis utilizes Gaussian process classification to build an automated framework for efficient, high-resolution estimation of the full audiometric function, which we call the machine learning audiogram (MLAG). This Bayesian technique iteratively computes a posterior distribution describing its current belief about detection probability given the current set of observed pure tones and detection responses. The posterior distribution can be used to provide a current point estimate of the psychometric function as well as to select an informative query point for the next stimulus to be provided to the listener. The Gaussian process covariance function ...}",2017,https://openscholarship.wustl.edu/eng_etds/310,,"Song, Xinyu",{Improving Pure-Tone Audiometry Using Probabilistic Machine Learning Classification},misc,eaa067e7ff40e6a8a6debde603644ec387f0cef7fb33032e8602f746028371d5,,
{en},{Neurology (clinical)},"{Source: Otology & Neurotology ; volume 43, issue 5, page e530-e534 ; ISSN 1531-7129 1537-4505 ; Description: Objective: The aim of this study is to compare machine learning algorithms and established rule-based evaluations in screening audiograms for the purpose of diagnosing vestibular schwannomas. A secondary aim is to assess the performance of rule-based evaluations for predicting vestibular schwannomas using the largest dataset in the literature. Study Design: Retrospective case-control study. Setting: Tertiary referral center. Patients: Seven hundred sixty seven adult patients with confirmed vestibular schwannoma and a pretreatment audiogram on file and 2000 randomly selected adult controls with audiograms. Intervention(s): Audiometric data were analyzed using machine learning algorithms and standard rule-based criteria for defining asymmetric hearing loss. Main Outcome Measures: The primary outcome is the ability to identify patients with vestibular schwannomas based on audiometric data alone, using machine learning algorithms and rule-based formulas. The secondary outcome is the application of conventional rule-based formulas to a larger dataset using advanced computational techniques. Results: The machine learning algorithms had mildly improved specificity in some fields compared with rule-based evaluations and had similar sensitivity to previous rule-based evaluations in diagnosis of vestibular schwannomas. Conclusions: Machine learning algorithms perform similarly to rule-based evaluations in identifying patients with vestibular schwannomas based on audiometric data alone. Performance of established rule-based formulas was consistent with earlier performance metrics, when analyzed using a large dataset.}",2022,http://dx.doi.org/10.1097/mao.0000000000003539,{Ovid Technologies (Wolters Kluwer Health)},"Carey, Grace E. AND Jacobson, Clare E. AND Warburton, Alyssa N. AND Biddle, Elliot AND Mannarelli, Greg AND Wilson, Michael AND Stucken, Emily Z.",{Machine Learning for Vestibular Schwannoma Diagnosis Using Audiometrie Data Alone},article,3f85d303f5f9cda2bfd30a10b72927341fda4a28b2497a1c803749c9e4a2b0ab,,
,,"{Source: 2022 4th International Conference on Circuits, Control, Communication and Computing (I4C)}",2022,http://dx.doi.org/10.1109/i4c57141.2022.10057711,{IEEE},"Gopinath, Anagha AND H, Akshitha AND Loomba, Arshya AND Kumar, Ranveer AND Narayanappa, CK",{Data Driven Machine Learning Model for Audiometric Threshold classification},proceedings,abe91b3684b37bffd24c85727109782e2d7c73bfcb95ee4161a00d74f11f0b75,,
,,{Description: Open Science Framework ; Supplementary materials and data related to dynamically masked audiometry research. ...},2022,https://dx.doi.org/10.17605/osf.io/gj8s5,,"Barbour, Dennis AND Heisey, Katherine AND Xie, Kevin AND Buchbinder, Jenna AND Walker, Alexandra",{Dynamically Masked Audiograms with Machine Learning Audiometry Supplement ...},misc,aefe6dba96ce365277c0aebe4de3e8eba9332e400686217b6eb41907fa11277e,,
{en},,"{Description: University of Liverpool ; Time Series Clustering Analysis: Exploring the Patterns of Hearing Loss in Adults (50+) in Cheshire and Merseyside ICS, 2013-2022 For more detailed information on this type of spatial analysis, please visit https://pro.arcgis.com/en/pro-app/latest/tool-reference/space-time-pattern-mining/time-series-clustering.htm}",2023,https://datacat.liverpool.ac.uk/2277/,,"Tsimpida, Dialechti","{Time Series Clustering Analysis: Exploring the Patterns of Hearing Loss in Adults (50 years old and above) in Cheshire and Merseyside ICS, 2013-2022. An Interactive Map Application.}",misc,32cf6167bdc4424da3db0ffc66022ca5d378b1900b8aecb9e0ade41a692ae837,,
